stories_id,publish_date,title,url,language,ap_syndicated,themes,media_id,media_name,media_url
"1622271587","2020-06-01 08:18:45","Civil unrest could influence Biden's search for running mate","http://www.nashvilleledger.com/editorial/Article.aspx?id=129769","en","True","","285648","tnledger.com","http://tnledger.com/"
"1622271560","2020-06-01 08:15:09","Floyd protests persist across Tennessee another day","http://www.nashvilleledger.com/editorial/Article.aspx?id=129761","en","True","","285648","tnledger.com","http://tnledger.com/"
"1622274517","2020-06-01 00:00:00","Should social media platforms be regulated?","http://www.johnsoncitypress.com/Editorial/2020/06/01/Should-social-media-platforms-be-regulated.html","en","False","","94065","johnsoncitypress.com","http://www.johnsoncitypress.com/#spider"
"1622292442","2020-06-01 09:20:03","Dozens of D.C. businesses damaged, looted following protests","http://feeds.bizjournals.com/~r/industry_6/~3/DVZivW9lLVY/dc-businesses-damaged-looted.html","en","False","","663152","Nashville Business Journal","http://www.bizjournals.com/nashville/"
"1622292679","2020-06-01 09:20:03","Dozens of D.C. businesses damaged, looted following protests","http://feeds.bizjournals.com/~r/industry_19/~3/DVZivW9lLVY/dc-businesses-damaged-looted.html","en","False","","663140","Memphis Business Journal","http://www.bizjournals.com/memphis/"
"1622294246","2020-06-01 09:47:52","Black Lives Matter-Knoxville organizers condemn Market Square vandalism","http://rssfeeds.knoxnews.com/~/625770132/0/knoxville/news~Black-Lives-MatterKnoxville-organizers-condemn-Market-Square-vandalism/","en","False","","89","The Knoxville News Sentinel ","http://www.knoxnews.com/"
"1622296479","2020-06-01 09:44:07","Fatal police shooting follows protests in Louisville Sunday, police confirm","http://rssfeeds.tennessean.com/~/625769722/0/nashville/home~Fatal-police-shooting-follows-protests-in-Louisville-Sunday-police-confirm/","en","False","","73100","blogs.tennessean.com","http://blogs.tennessean.com/#spider"
"1622308884","2020-06-01 07:50:20","A weekend of unrest in Tampa: Scenes of protests, destroyed properties and businesses bracing for damage (Photos)","http://feeds.bizjournals.com/~r/industry_20/~3/WeVxsWrkLTE/tampa-george-floyd-protests-university-downtown.html","en","False","","663152","Nashville Business Journal","http://www.bizjournals.com/nashville/"
"1622310131","2020-06-01 07:50:20","A weekend of unrest in Tampa: Scenes of protests, destroyed properties and businesses bracing for damage (Photos)","http://feeds.bizjournals.com/~r/industry_20/~3/WeVxsWrkLTE/tampa-george-floyd-protests-university-downtown.html","en","False","","663140","Memphis Business Journal","http://www.bizjournals.com/memphis/"
"1622313068","2020-06-01 07:38:50","Federal officials investigating if extremist groups infiltrated protests","https://www.wkrn.com/news/federal-officials-investigating-if-extremist-groups-infiltrated-protests/","en","True","","84748","wkrn.com","http://www.wkrn.com/#spider"
"1622313066","2020-06-01 08:12:32","TWRA relocates bear after damage to Gatlinburg home","https://www.wkrn.com/news/twra-relocates-bear-after-damage-to-gatlinburg-home/","en","False","","84748","wkrn.com","http://www.wkrn.com/#spider"
"1622313060","2020-06-01 09:22:28","Man charged with punching officer, destroying watch during riot in downtown Nashville","https://www.wkrn.com/news/crime-tracker/man-charged-with-punching-officer-destroying-watch-during-riot-in-downtown-nashville/","en","False","","84748","wkrn.com","http://www.wkrn.com/#spider"
"1622314679","2020-06-01 09:44:07","Fatal police shooting follows protests in Louisville Sunday, police confirm","http://rssfeeds.knoxnews.com/~/625769722/0/knoxville/home/~Fatal-police-shooting-follows-protests-in-Louisville-Sunday-police-confirm/","en","False","","607964","Shopper News","https://www.knoxnews.com/shopper-news/"
"1622314653","2020-06-01 09:47:52","Black Lives Matter-Knoxville organizers condemn Market Square vandalism","http://rssfeeds.knoxnews.com/~/625770132/0/knoxville/home/~Black-Lives-MatterKnoxville-organizers-condemn-Market-Square-vandalism/","en","False","","607964","Shopper News","https://www.knoxnews.com/shopper-news/"
"1622323087","2020-06-01 01:30:00","Violence Escalates As Protests Over George Floyd Death Continue","https://www.wknofm.org/post/violence-escalates-protests-over-george-floyd-death-continue","en","False","","90047","wknofm.org","http://wknofm.org/#spider"
"1622323081","2020-06-01 05:00:00","Restaurant Owner Whose Business Burned Calls For Justice For George Floyd","https://www.wknofm.org/post/restaurant-owner-whose-business-burned-calls-justice-george-floyd","en","False","","90047","wknofm.org","http://wknofm.org/#spider"
"1622323079","2020-06-01 05:00:00","Trump Seems Likely To Use Law And Order As A Wedge Issue After George Floyd's Killing","https://www.wknofm.org/post/trump-seems-likely-use-law-and-order-wedge-issue-after-george-floyds-killing","en","False","","90047","wknofm.org","http://wknofm.org/#spider"
"1622327838","2020-06-01 09:44:07","Fatal police shooting follows protests in Louisville Sunday, police confirm","http://rssfeeds.knoxnews.com/~/625769722/0/knoxville/home/~Fatal-police-shooting-follows-protests-in-Louisville-Sunday-police-confirm/","en","False","","89","The Knoxville News Sentinel ","http://www.knoxnews.com/"
"1622327920","2020-06-01 09:44:07","Fatal police shooting follows protests in Louisville Sunday, police confirm","http://rssfeeds.theleafchronicle.com/~/625769722/0/clarksville/home~Fatal-police-shooting-follows-protests-in-Louisville-Sunday-police-confirm/","en","False","","143905","theleafchronicle.com","http://theleafchronicle.com/"
"1622342769","2020-06-01 09:55:28","Tennessee Governor Bill Lee Mobilizes National Guard Across the State","https://www.clarksvilleonline.com/2020/06/01/tennessee-governor-bill-lee-mobilizes-national-guard-across-the-state/?utm_source=rss&utm_medium=rss&utm_campaign=tennessee-governor-bill-lee-mobilizes-national-guard-across-the-state","en","False","","24816","clarksvilleonline.com","http://www.clarksvilleonline.com"
"1622352663","2020-06-01 00:00:00","Floyd protests persist across Tennessee another day","http://www.johnsoncitypress.com/State/2020/06/01/Floyd-protests-persist-across-Tennessee-another-day.html","en","False","","94065","johnsoncitypress.com","http://www.johnsoncitypress.com/#spider"
"1622376863","2020-06-01 10:46:10","Newsfeed Now: Protests across America morning update – June 1, 2020","https://www.wate.com/news/newsfeed-now-protests-across-america-morning-update-june-1-2020/","en","False","","84580","wate.com","http://www.wate.com/#spider"
"1622376856","2020-06-01 10:32:29","Local activists condemn riots — ” Do not be counterproductive to movements that are already successful”","https://www.wate.com/news/top-stories/local-activists-condemn-riots-do-not-be-counter-productive-to-movements-that-are-already-successful/","en","False","","84580","wate.com","http://www.wate.com/#spider"
"1622379183","2020-06-01 08:51:45","Tim Boyd Says Mayor Berke Needs To Put A Curfew In Place","http://www.chattanoogan.com/2020/6/1/409864/Tim-Boyd-Says-Mayor-Berke-Needs-To-Put.aspx","en","False","","663090","Chattanoogan","http://www.chattanoogan.com/Breaking-News/"
"1622379177","2020-06-01 08:11:39","Another Night Of Protest, Unrest In Chattanooga; National Guard Makes 1st Appearance","http://www.chattanoogan.com/2020/6/1/409860/Another-Night-Of-Protest-Unrest-In.aspx","en","False","","663090","Chattanoogan","http://www.chattanoogan.com/Breaking-News/"
"1622379175","2020-06-01 20:01:00","Protestors Face Off With Law Enforcement At County Courthouse; Tear Gas Used After Incident On Balcony; Lee Mobilizes Guard And Seeks Further Investigation Into Nashville Unrest","http://www.chattanoogan.com/2020/6/1/409849/Protestors-Face-Off-With-Law.aspx","en","False","","663090","Chattanoogan","http://www.chattanoogan.com/Breaking-News/"
"1622380809","2020-06-01 09:19:35","Trump briefly taken to underground bunker as protests grew outside White House","https://www.columbiadailyherald.com/zz/news/20200601/trump-briefly-taken-to-underground-bunker-as-protests-grew-outside-white-house?rssfeed=true","en","False","","106478","columbiadailyherald.com","http://columbiadailyherald.com/"
"1622380806","2020-06-01 10:36:40","George Floyd protests continue nationwide, 4,400 arrests reported; St. John's Church in DC set on fire: live updates","https://www.columbiadailyherald.com/zz/news/20200601/george-floyd-protests-continue-nationwide-4400-arrests-reported-st-johns-church-in-dc-set-on-fire-live-updates?rssfeed=true","en","False","","106478","columbiadailyherald.com","http://columbiadailyherald.com/"
"1622383750","2020-06-01 11:43:28","CVS closes stores across 20 states. Call ahead, if you're planning on visiting one.","https://www.columbiadailyherald.com/zz/business/20200601/cvs-closes-stores-across-20-states-call-ahead-if-youre-planning-on-visiting-one?rssfeed=true","en","False","","106478","columbiadailyherald.com","http://columbiadailyherald.com/"
"1622393430","2020-06-01 10:08:13","Louisville police and soldiers return fire, killing man","https://www.wkrn.com/news/louisville-police-and-soldiers-return-fire-killing-man/","en","True","","84748","wkrn.com","http://www.wkrn.com/#spider"
"1622393423","2020-06-01 11:05:57","Mayor Cooper issues 10 p.m. curfew for Nashville Monday","https://www.wkrn.com/news/local-news/mayor-cooper-issues-10-pm-curfew-for-nashville-on-june-1/","en","False","","84748","wkrn.com","http://www.wkrn.com/#spider"
"1622402996","2020-06-01 11:48:23","Mayor Cooper announces 10 p.m. curfew for Nashville Tuesday night. What are the rules of curfew?","http://rssfeeds.tennessean.com/~/625776184/0/nashville/home~Mayor-Cooper-announces-pm-curfew-for-Nashville-Tuesday-night-What-are-the-rules-of-curfew/","en","False","","73100","blogs.tennessean.com","http://blogs.tennessean.com/#spider"
"1622402980","2020-06-01 11:04:32","#TheShowMustBePaused: Music industry plans blackout Tuesday in response to George Floyd death","http://rssfeeds.tennessean.com/~/625774460/0/nashville/home~TheShowMustBePaused-Music-industry-plans-blackout-Tuesday-in-response-to-George-Floyd-death/","en","False","","73100","blogs.tennessean.com","http://blogs.tennessean.com/#spider"
"1622409011","2020-06-01 12:08:35","What is antifa and what does the movement want?","https://www.columbiadailyherald.com/zz/news/20200601/what-is-antifa-and-what-does-movement-want?rssfeed=true","en","False","","106478","columbiadailyherald.com","http://columbiadailyherald.com/"
"1622412872","2020-06-01 00:00:00","The Latest: Arrest in historic Nashville courthouse fire","http://www.timesnews.net/State/2020/06/01/The-Latest-Arrest-in-historic-Nashville-courthouse-fire.html","en","False","","653457","Kingsport Times-News","http://www.timesnews.net/"
"1622416377","2020-06-01 00:00:00","The Latest: Arrest in historic Nashville courthouse fire","http://www.timesnews.net/State/2020/06/01/The-Latest-Arrest-in-historic-Nashville-courthouse-fire.html","en","False","","94121","timesnews.net","http://www.timesnews.net/#spider"
"1622433245","2020-06-01 12:03:54","Biden meets with black leaders at local church amid unrest","http://www.nashvilleledger.com/editorial/Article.aspx?id=129784","en","True","","285648","tnledger.com","http://tnledger.com/"
"1622433226","2020-06-01 11:57:12","Police arrest man in arson of historic Nashville courthouse","http://www.nashvilleledger.com/editorial/Article.aspx?id=129775","en","True","","285648","tnledger.com","http://tnledger.com/"
"1622436282","2020-06-01 12:36:40","Their stores were burned, ransacked and looted. What's next for Minneapolis-area small business owners in danger of losing livelihoods?","https://www.columbiadailyherald.com/zz/news/20200601/their-stores-were-burned-ransacked-and-looted-whats-next-for-minneapolis-area-small-business-owners-in-danger-of-losing-livelihoods?rssfeed=true","en","False","","106478","columbiadailyherald.com","http://columbiadailyherald.com/"
"1622436279","2020-06-01 12:52:19","It's time to stand up': Peaceful demonstrations, looting and chanting on sixth night of George Floyd protests","https://www.columbiadailyherald.com/zz/news/20200601/its-time-to-stand-up-peaceful-demonstrations-looting-and-chanting-on-sixth-night-of-george-floyd-protests?rssfeed=true","en","False","","106478","columbiadailyherald.com","http://columbiadailyherald.com/"
"1622456527","2020-06-01 11:33:00","Protesters Took to Memphis Streets Over Weekend, Speaking Out Against Police Brutality","https://www.memphisflyer.com/NewsBlog/archives/2020/06/01/protesters-took-to-memphis-streets-over-weekend-speaking-out-against-police-brutality","en","False","","82239","memphisflyer.com","http://www.memphisflyer.com/#spider"
"1622457491","2020-06-01 00:00:00","The Latest: Arrest in historic Nashville courthouse fire","http://www.johnsoncitypress.com/State/2020/06/01/The-Latest-Arrest-in-historic-Nashville-courthouse-fire.html","en","False","","94065","johnsoncitypress.com","http://www.johnsoncitypress.com/#spider"
"1622457489","2020-06-01 00:00:00","Convulsing in protest, US cities brace for more unrest","http://www.johnsoncitypress.com/Nation/2020/06/01/Convulsing-in-protest-US-cities-brace-for-more-unrest.html","en","False","","94065","johnsoncitypress.com","http://www.johnsoncitypress.com/#spider"
"1622457488","2020-06-01 00:00:00","Biden meets with black leaders at local church amid unrest","http://www.johnsoncitypress.com/Politics/2020/06/01/Biden-meets-with-black-leaders-at-local-church-amid-unrest.html","en","False","","94065","johnsoncitypress.com","http://www.johnsoncitypress.com/#spider"
"1622476749","2020-06-01 12:59:01","Will the Nashville protest lead to a surge of coronavirus? We will know in a week.","http://rssfeeds.tennessean.com/~/625782796/0/nashville/home~Will-the-Nashville-protest-lead-to-a-surge-of-coronavirus-We-will-know-in-a-week/","en","False","","73100","blogs.tennessean.com","http://blogs.tennessean.com/#spider"
"1622481585","2020-06-01 10:26:48","CVS closes stores across 20 states. Call ahead, if you're planning on visiting one.","https://www.oakridger.com/zz/business/20200601/cvs-closes-stores-across-20-states-call-ahead-if-youre-planning-on-visiting-one?rssfeed=true","en","False","","152402","oakridger.com","http://oakridger.com/"
"1622498853","2020-06-01 13:27:43","Marauders strike terror in downtown Memphis","https://tri-statedefender.com/marauders-strike-terror-in-downtown-memphis/06/01/?utm_source=rss&utm_medium=rss&utm_campaign=marauders-strike-terror-in-downtown-memphis","en","False","","284383","Welcome to The Tri-State Defender","http://tsdmemphis.com/"
"1622502262","2020-06-01 11:01:53","What we know about antifa, the group Trump wants to name a terrorist organization","https://www.tennessean.com/story/news/2020/05/31/trump-antifa-terrorist-group-tennessee/5300506002/","en","False","","658835","State News - United States - Tennessee","http://www.tennessee.statenews.net/"
"1622503678","2020-06-01 06:32:46","Federal officials investigating if  extremist groups infiltrated protests","https://wreg.com/news/federal-officials-investigating-if-extremist-groups-infiltrated-protests/","en","True","","78089","wreg.com","http://www.wreg.com/#spider"
"1622503674","2020-06-01 07:30:21","Photos: Protests continue to rock America","https://wreg.com/news/photos-protests-continue-to-rock-america/","en","False","","78089","wreg.com","http://www.wreg.com/#spider"
"1622503671","2020-06-01 11:26:16","Activists say police escalated situation as Saturday night protests turned violent","https://wreg.com/news/activists-say-police-escalated-situation-as-saturday-night-protests-turned-violent/","en","False","","78089","wreg.com","http://www.wreg.com/#spider"
"1622503658","2020-06-01 13:09:54","NAACP to hold news conference after death of George Floyd","https://wreg.com/news/naacp-to-hold-news-conference-after-death-of-george-floyd/","en","True","","78089","wreg.com","http://www.wreg.com/#spider"
"1622503700","2020-06-01 11:53:22","Cleanup efforts underway after violent Nashville protest","https://wnws.com/cleanup-efforts-underway-after-violent-nashville-protest/","en","True","","663112","WNWS","https://wnws.com/"
"1622503651","2020-06-01 07:27:12","Reports of vandalism, shootings across city after night of unrest","https://wreg.com/news/reports-of-vandalism-across-city-after-night-of-unrest-national-guard-seen-in-downtown-memphis/","en","False","","78089","wreg.com","http://www.wreg.com/#spider"
"1622505454","2020-06-01 13:26:50","George Floyd. Ahmaud Arbery. Breonna Taylor. What do we tell our children?","https://www.columbiadailyherald.com/zz/news/20200601/george-floyd-ahmaud-arbery-breonna-taylor-what-do-we-tell-our-children?rssfeed=true","en","False","","106478","columbiadailyherald.com","http://columbiadailyherald.com/"
"1622505445","2020-06-01 13:49:31","Minneapolis is trying to recover after days of George Floyd protests – one bag of garbage and one food donation at a time","https://www.columbiadailyherald.com/zz/news/20200601/minneapolis-is-trying-to-recover-after-days-of-george-floyd-protests---one-bag-of-garbage-and-one-food-donation-at-time?rssfeed=true","en","False","","106478","columbiadailyherald.com","http://columbiadailyherald.com/"
"1622526345","2020-06-01 13:54:00","Elected Officials Across State Respond to Police Brutality, Protests","https://www.memphisflyer.com/NewsBlog/archives/2020/06/01/elected-officials-across-state-respond-to-police-brutality-protests","en","False","","82239","memphisflyer.com","http://www.memphisflyer.com/#spider"
"1622548156","2020-06-01 13:00:35","Sheriff's Office Says Tear Gas Was Used Against Protestors When They Tried To Pull Deputy Into Crowd","http://www.chattanoogan.com/2020/6/1/409874/Sheriff-s-Office-Says-Tear-Gas-Was-Used.aspx","en","False","","663090","Chattanoogan","http://www.chattanoogan.com/Breaking-News/"
"1622556116","2020-06-01 14:33:20","Music industry calls for Black Out Tuesday amid unrest","https://www.wate.com/news/music-industry-calls-for-black-out-tuesday-amid-unrest/","en","True","","84580","wate.com","http://www.wate.com/#spider"
"1622565978","2020-06-01 14:48:48","TSD FLASH! — Unrest in Memphis, Day V","https://tri-statedefender.com/tsd-flash-unrest-in-memphis-day-v/06/01/?utm_source=rss&utm_medium=rss&utm_campaign=tsd-flash-unrest-in-memphis-day-v","en","False","","284383","Welcome to The Tri-State Defender","http://tsdmemphis.com/"
"1622566592","2020-06-01 08:02:55","Trump briefly taken to underground bunker as protests grew outside White House","https://www.oakridger.com/zz/news/20200601/trump-briefly-taken-to-underground-bunker-as-protests-grew-outside-white-house?rssfeed=true","en","False","","152402","oakridger.com","http://oakridger.com/"
"1622566590","2020-06-01 09:20:00","George Floyd protests continue nationwide, 4,400 arrests reported; St. John's Church in DC set on fire: live updates","https://www.oakridger.com/zz/news/20200601/george-floyd-protests-continue-nationwide-4400-arrests-reported-st-johns-church-in-dc-set-on-fire-live-updates?rssfeed=true","en","False","","152402","oakridger.com","http://oakridger.com/"
"1622566586","2020-06-01 11:20:00","Their stores were burned, ransacked and looted. What's next for Minneapolis-area small business owners in danger of losing livelihoods?","https://www.oakridger.com/zz/news/20200601/their-stores-were-burned-ransacked-and-looted-whats-next-for-minneapolis-area-small-business-owners-in-danger-of-losing-livelihoods?rssfeed=true","en","False","","152402","oakridger.com","http://oakridger.com/"
"1622566583","2020-06-01 10:51:55","What is antifa and what does the movement want?","https://www.oakridger.com/zz/news/20200601/what-is-antifa-and-what-does-movement-want?rssfeed=true","en","False","","152402","oakridger.com","http://oakridger.com/"
"1622567025","2020-06-01 13:57:00","Former President Obama: 'Let's Not Excuse Violence ... Or Participate In It'","https://www.wmot.org/post/former-president-obama-lets-not-excuse-violence-or-participate-it","en","False","","310386","wmot.org","http://wmot.org/"
"1622566576","2020-06-01 11:35:39","It's time to stand up': Peaceful demonstrations, looting and chanting on sixth night of George Floyd protests","https://www.oakridger.com/zz/news/20200601/its-time-to-stand-up-peaceful-demonstrations-looting-and-chanting-on-sixth-night-of-george-floyd-protests?rssfeed=true","en","False","","152402","oakridger.com","http://oakridger.com/"
"1622566571","2020-06-01 12:10:10","George Floyd. Ahmaud Arbery. Breonna Taylor. What do we tell our children?","https://www.oakridger.com/zz/news/20200601/george-floyd-ahmaud-arbery-breonna-taylor-what-do-we-tell-our-children?rssfeed=true","en","False","","152402","oakridger.com","http://oakridger.com/"
"1622566565","2020-06-01 12:32:51","Minneapolis is trying to recover after days of George Floyd protests – one bag of garbage and one food donation at a time","https://www.oakridger.com/zz/news/20200601/minneapolis-is-trying-to-recover-after-days-of-george-floyd-protests---one-bag-of-garbage-and-one-food-donation-at-time?rssfeed=true","en","False","","152402","oakridger.com","http://oakridger.com/"
"1622569519","2020-06-01 14:24:14","City leaders implement curfew for Memphis","https://wreg.com/news/watch-strickland-rallings-to-hold-news-conference/","en","False","","78089","wreg.com","http://www.wreg.com/#spider"
"1622570632","2020-06-01 13:52:15","Unrest could influence Biden's search for election running mate","https://www.columbiadailyherald.com/news/20200601/unrest-could-influence-biden8217s-search-for-election-running-mate?rssfeed=true","en","False","politics and government, united states politics and government, elections, blacks, mayors","106478","columbiadailyherald.com","http://columbiadailyherald.com/"
"1622586993","2020-06-01 14:39:00","Biden Meets With Black Faith Leaders In Delaware Following Days Of Protest","https://www.wmot.org/post/biden-meets-black-faith-leaders-delaware-following-days-protest","en","False","politics and government, united states politics and government, elections, blacks, police, demonstrations and riots","310386","wmot.org","http://wmot.org/"
"1622590414","2020-06-01 13:54:04","Convulsing in protest, US cities brace for more unrest","https://www.columbiadailyherald.com/news/20200601/convulsing-in-protest-us-cities-brace-for-more-unrest?rssfeed=true","en","False","politics and government, blacks, police, demonstrations and riots","106478","columbiadailyherald.com","http://columbiadailyherald.com/"
"1622590639","2020-06-01 15:44:50","Former Knoxville man charged in arson at historic Nashville courthouse","http://rssfeeds.knoxnews.com/~/625793324/0/knoxville/home/~Former-Knoxville-man-charged-in-arson-at-historic-Nashville-courthouse/","en","False","blacks, police, crime and criminals, demonstrations and riots, fires and firefighters, fires and firemen, police brutality and misconduct, arson, attacks on police","89","The Knoxville News Sentinel ","http://www.knoxnews.com/"
"1622599826","2020-06-01 15:44:50","Former Knoxville man charged in arson at historic Nashville courthouse","http://rssfeeds.knoxnews.com/~/625793324/0/knoxville/home/~Former-Knoxville-man-charged-in-arson-at-historic-Nashville-courthouse/","en","False","blacks, police, crime and criminals, demonstrations and riots, fires and firefighters, fires and firemen, police brutality and misconduct, arson, attacks on police","607964","Shopper News","https://www.knoxnews.com/shopper-news/"
"1622610439","2020-06-01 14:40:04","Our leaders need to uplift those who protest racial injustice, not condemn them | Opinion","http://rssfeeds.commercialappeal.com/~/625789734/0/memphis/opinion~Our-leaders-need-to-uplift-those-who-protest-racial-injustice-not-condemn-them-Opinion/","en","False","politics and government, united states politics and government, armament, defense and military forces, united states armament and defense","71","The Commercial Appeal","http://www.commercialappeal.com/"
"1622611234","2020-06-01 22:30:00","Police Make 8 Arrests During Late Night Protests On Sunday In Chattanooga; Officers Say Crowd Tried To Push Their Way Into The County Courthouse","http://www.chattanoogan.com/2020/6/1/409867/Police-Make-8-Arrests-During-Late-Night.aspx","en","False","police, demonstrations and riots","663090","Chattanoogan","http://www.chattanoogan.com/Breaking-News/"
"1622614573","2020-06-01 16:10:43","Facebook employees speak out against company over Trump","http://www.nashvilleledger.com/editorial/Article.aspx?id=129787","en","True","computers and the internet, labor, demonstrations and riots","285648","tnledger.com","http://tnledger.com/"
"1622614571","2020-06-01 16:10:17","Stock indexes close higher on Wall Street after wobbly start","http://www.nashvilleledger.com/editorial/Article.aspx?id=129786","en","True","finances, medicine and health, diseases and conditions, economic conditions and trends, stocks and bonds","285648","tnledger.com","http://tnledger.com/"
"1622616077","2020-06-01 16:11:17","‘My heart is broken’: Lawmakers weigh in on protests across the nation","https://www.wate.com/news/my-heart-is-broken-lawmakers-weigh-in-on-protests-across-the-nation/","en","False","politics and government, blacks, demonstrations and riots","84580","wate.com","http://www.wate.com/#spider"
"1622620418","2020-06-01 16:33:09","'Breeding grounds for this virus': Health experts warn large protests heighten risk of coronavirus spread","https://www.columbiadailyherald.com/zz/news/20200601/breeding-grounds-for-this-virus-health-experts-warn-large-protests-heighten-risk-of-coronavirus-spread?rssfeed=true","en","False","medicine and health, diseases and conditions, demonstrations and riots, viruses","106478","columbiadailyherald.com","http://columbiadailyherald.com/"
