stories_id,publish_date,title,url,language,ap_syndicated,themes,media_id,media_name,media_url
"1622811453","2020-06-01 21:00:00","New Haven mayor pledges action; chief defends pepper spray use","https://www.nhregister.com/news/article/New-Haven-mayor-pledges-action-chief-defends-15309670.php","en","False","","32270","nhregister.com","http://nhregister.com#spider"
"1622816227","2020-06-01 10:30:00","PHOTOS: Hundreds turn out for Darien’s Cross Walk Sunday","https://www.darientimes.com/news/article/PHOTOS-Hundreds-turn-out-for-Darien-s-Cross-15308111.php","en","False","","213954","dariennewsonline.com","http://dariennewsonline.com/"
"1622824173","2020-06-01 22:19:35","Gov. Lamont addresses Trump’s comments that governors are ‘weak’ after protests erupt over the weekend","https://www.wtnh.com/news/connecticut/hartford/governor-lamont-addresses-trumps-comments-that-governors-are-weak-after-protests-erupt-over-the-weekend/","en","False","","77085","wtnh.com","http://www.wtnh.com/#spider"
"1622824170","2020-06-01 22:12:35","New Haven leaders respond to unrest, protest in the Elm City","https://www.wtnh.com/news/connecticut/new-haven/new-haven-leaders-respond-to-unrest-protest-in-the-elm-city/","en","False","","77085","wtnh.com","http://www.wtnh.com/#spider"
"1622824542","2020-06-01 20:25:29","Egypt's former PM faces torture allegations in Washington DC","https://www.norwichbulletin.com/ZZ/news/20200601/egypts-former-pm-faces-torture-allegations-in-washington-dc?rssfeed=true","en","True","","74242","norwichbulletin.com","http://www.norwichbulletin.com/#spider"
"1622824537","2020-06-01 20:42:53","Louisville police chief fired in aftermath of fatal shooting","https://www.norwichbulletin.com/ZZ/news/20200601/louisville-police-chief-fired-in-aftermath-of-fatal-shooting?rssfeed=true","en","True","","74242","norwichbulletin.com","http://www.norwichbulletin.com/#spider"
"1622828863","2020-06-01 22:32:44","Tear gas, threats for protesters before Trump visits church","https://www.norwichbulletin.com/ZZ/news/20200601/tear-gas-threats-for-protesters-before-trump-visits-church?rssfeed=true","en","True","","74242","norwichbulletin.com","http://www.norwichbulletin.com/#spider"
"1622828859","2020-06-01 22:49:08","SUV hits 2 officers at Floyd protest in Buffalo, speeds off","https://www.norwichbulletin.com/ZZ/news/20200601/suv-hits-2-officers-at-floyd-protest-in-buffalo-speeds-off?rssfeed=true","en","True","","74242","norwichbulletin.com","http://www.norwichbulletin.com/#spider"
"1622833633","2020-06-01 23:32:49","SUV hits 2 police officers at Floyd protest in Buffalo, speeds off","https://www.theday.com/nationworld-news/20200601/suv-hits-2-police-officers-at-floyd-protest-in-buffalo-speeds-off","en","True","","76581","theday.com","http://www.theday.com/#spider"
"1622849632","2020-06-02 00:00:00","Opinion: ‘How do you know it was racially motivated?’","https://www.nhregister.com/opinion/article/Opinion-How-do-you-know-it-was-racially-15308470.php","en","False","","32270","nhregister.com","http://nhregister.com#spider"
"1622850965","2020-06-01 23:06:51","Lamont: Trump called governors 'fools and jerks' over response to protesters","https://www.theday.com/statenortheast-news/20200602/lamont-trump-called-governors-fools-and-jerks-over-response-to-protesters","en","False","","76581","theday.com","http://www.theday.com/#spider"
"1622850964","2020-06-01 23:20:59","Protests reignite despite new curfews, larger police presence in many cities","https://www.theday.com/nationworld-news/20200602/protests-reignite-despite-new-curfews-larger-police-presence-in-many-cities","en","False","","76581","theday.com","http://www.theday.com/#spider"
"1622850962","2020-06-01 23:28:37","George Floyd's death was a homicide, according to two autopsies","https://www.theday.com/nationworld-news/20200602/george-floyds-death-was-homicide-according-to-two-autopsies","en","False","","76581","theday.com","http://www.theday.com/#spider"
"1622857740","2020-06-02 00:14:48","Macy's, other stores broken into as NYC imposes curfew amid Floyd protests","https://www.theday.com/statenortheast-news/20200602/macys-other-stores-broken-into-as-nyc-imposes-curfew-amid-floyd-protests","en","True","","76581","theday.com","http://www.theday.com/#spider"
"1622859233","2020-06-02 00:17:35","'Hate just hides': Biden vows to take on systematic racism","https://www.nhregister.com/news/article/Hate-just-hides-Biden-vows-to-take-on-15309908.php","en","True","","32270","nhregister.com","http://nhregister.com#spider"
"1622859228","2020-06-02 00:19:11","A look at the antifa movement Trump is blaming for violence","https://www.nhregister.com/news/article/A-look-at-the-antifa-movement-Trump-is-blaming-15309910.php","en","True","","32270","nhregister.com","http://nhregister.com#spider"
"1622859225","2020-06-02 00:22:48","Black female mayors in spotlight amid protests and pandemic","https://www.nhregister.com/news/article/Black-female-mayors-in-spotlight-amid-protests-15309916.php","en","True","","32270","nhregister.com","http://nhregister.com#spider"
"1622859210","2020-06-02 00:33:16","Barr: Law enforcement must ‘dominate’ streets amid protests","https://www.nhregister.com/news/article/Barr-Law-enforcement-must-dominate-streets-15309926.php","en","True","","32270","nhregister.com","http://nhregister.com#spider"
"1622859208","2020-06-02 00:34:30","Presidents have leeway to use military for domestic purposes","https://www.nhregister.com/news/article/Presidents-have-leeway-to-use-military-for-15309935.php","en","True","","32270","nhregister.com","http://nhregister.com#spider"
"1622859204","2020-06-02 00:36:02","Amid protests, Trump talks of war — and reelection","https://www.nhregister.com/news/article/Amid-protests-Trump-talks-of-war-and-15309936.php","en","True","","32270","nhregister.com","http://nhregister.com#spider"
"1622903953","2020-06-01 14:39:00","Biden Meets With Black Faith Leaders In Delaware Following Days Of Protest","https://www.wshu.org/post/biden-meets-black-faith-leaders-delaware-following-days-protest","en","False","","189417","wshu.org","http://wshu.org/"
"1622903948","2020-06-01 15:38:00","Attorney General Steps Up Federal Law Enforcement Response To Protests","https://www.wshu.org/post/attorney-general-steps-federal-law-enforcement-response-protests","en","False","","189417","wshu.org","http://wshu.org/"
"1622903937","2020-06-01 16:22:00","'We Recognize That There's A Need To Change': What Police Think About Civil Unrest","https://www.wshu.org/post/we-recognize-theres-need-change-what-police-think-about-civil-unrest","en","False","","189417","wshu.org","http://wshu.org/"
"1622903932","2020-06-01 16:30:00","Hong Kong Police Block Tiananmen Square Vigil, Citing Coronavirus Concerns","https://www.wshu.org/post/hong-kong-police-block-tiananmen-square-vigil-due-coronavirus","en","False","","189417","wshu.org","http://wshu.org/"
"1622903927","2020-06-01 16:46:00","Anti-Racism Protests Versus COVID-19 Risk: 'I Wouldn't Weigh These Crises Separately'","https://www.wshu.org/post/protests-over-racism-versus-risk-covid-i-wouldnt-weigh-these-crises-separately","en","False","","189417","wshu.org","http://wshu.org/"
"1622903925","2020-06-01 16:59:00","From Jobs To Homeownership, Protests Put Spotlight On Economic Divide","https://www.wshu.org/post/jobs-homeownership-protests-put-spotlight-economic-divide","en","False","","189417","wshu.org","http://wshu.org/"
"1622903924","2020-06-01 17:11:13","Connecticut Lawmakers, Faith Leaders And Police Talk After Protest Arrests","https://www.wshu.org/post/connecticut-lawmakers-faith-leaders-and-police-talk-after-protest-arrests","en","False","","189417","wshu.org","http://wshu.org/"
"1622903917","2020-06-01 19:01:00","USC Professor On How Protests Have Changed Since LA Riots In 1992","https://www.wshu.org/post/usc-professor-how-protests-have-changed-la-riots-1992","en","False","","189417","wshu.org","http://wshu.org/"
"1622920659","2020-06-01 18:53:00","New Canaan has brief quiet protest","https://www.ncadvertiser.com/news/article/New-Canaan-has-brief-quiet-protest-15309346.php","en","False","","321497","newcanaannewsonline.com","http://newcanaannewsonline.com/"
"1622929044","2020-06-02 02:47:47","Demonstrators abroad identify with the cause of US protests","https://www.nhregister.com/news/article/Demonstrators-abroad-identify-with-the-cause-of-15310008.php","en","True","","32270","nhregister.com","http://nhregister.com#spider"
"1622938113","2020-06-01 18:00:00","Haar: Seeking justice through God, not through Marching","https://www.thehour.com/news/article/Dan-Haar-A-pulpit-message-in-protest-shadows-15309285.php","en","False","","160152","thehour.com","http://thehour.com/"
"1622949010","2020-06-03 00:10:31","Amid protests, Trump talks of war "" and reelection","https://www.norwichbulletin.com/ZZ/news/20200602/amid-protests-trump-talks-of-war--and-reelection?rssfeed=true","en","True","","74242","norwichbulletin.com","http://www.norwichbulletin.com/#spider"
"1622949009","2020-06-03 00:21:21","Black female mayors in spotlight amid protests and pandemic","https://www.norwichbulletin.com/ZZ/news/20200602/black-female-mayors-in-spotlight-amid-protests-and-pandemic?rssfeed=true","en","True","","74242","norwichbulletin.com","http://www.norwichbulletin.com/#spider"
"1622958552","2020-06-01 18:00:00","Haar: Seeking justice through God, not through Marching","https://www.stamfordadvocate.com/news/article/Dan-Haar-A-pulpit-message-in-protest-shadows-15309285.php","en","False","","25411","stamfordadvocate.com","http://www.stamfordadvocate.com"
"1622963548","2020-06-02 03:13:56","Asian shares gain on hopes for regional economies reopening","https://www.nhregister.com/news/article/Asian-shares-gain-on-hopes-for-regional-economies-15310029.php","en","True","","32270","nhregister.com","http://nhregister.com#spider"
"1622963546","2020-06-02 03:34:00","Showdown: Law-and-order president versus protesters","https://www.nhregister.com/news/article/Showdown-Law-and-order-president-versus-15310045.php","en","True","","32270","nhregister.com","http://nhregister.com#spider"
"1623014801","2020-06-02 01:36:58","Democratic governors reject Trump's call to send in military","https://www.norwichbulletin.com/ZZ/news/20200602/democratic-governors-reject-trumps-call-to-send-in-military?rssfeed=true","en","True","","74242","norwichbulletin.com","http://www.norwichbulletin.com/#spider"
"1623065355","2020-06-02 05:00:00","Sports Figures Add Their Voices To Those Of Angry Protesters","https://www.wshu.org/post/sports-figures-add-their-voices-those-angry-protesters","en","False","","189417","wshu.org","http://wshu.org/"
"1623089214","2020-06-02 04:41:41","Thousands march in Sydney in solidarity with US protests","https://www.norwichbulletin.com/ZZ/news/20200602/thousands-march-in-sydney-in-solidarity-with-us-protests?rssfeed=true","en","True","","74242","norwichbulletin.com","http://www.norwichbulletin.com/#spider"
"1623089208","2020-06-02 05:28:48","2 Las Vegas shootings, 1 officer shot amid Floyd protests","https://www.norwichbulletin.com/news/20200602/2-las-vegas-shootings-1-officer-shot-amid-floyd-protests?rssfeed=true","en","True","","74242","norwichbulletin.com","http://www.norwichbulletin.com/#spider"
"1623115182","2020-06-02 06:00:00","Troopers: Man arrested after found walking on highway hours after protest","https://www.ctpost.com/news/article/Troopers-Man-arrested-after-found-walking-on-15310222.php","en","False","","35035","ctpost.com","http://www.ctpost.com#spider"
"1623116903","2020-06-01 22:35:34","Waterbury community, lawmakers convene virtually to discuss how to reach out to minority groups following the death of George Floyd","https://www.wtnh.com/news/connecticut/new-haven/waterbury-community-lawmakers-convene-virtually-to-discuss-how-to-reach-out-to-minority-groups-following-the-death-of-george-floyd/","en","False","","77085","wtnh.com","http://www.wtnh.com/#spider"
"1623116900","2020-06-02 06:25:09","Ride for Unity rally in New Britain to take a stand against racism","https://www.wtnh.com/news/ride-for-unity-rally-in-new-britain-to-take-a-stand-against-racism/","en","True","","77085","wtnh.com","http://www.wtnh.com/#spider"
"1623116892","2020-06-02 03:53:21","New Haven Clergy Association to meet and discuss policing in black communities","https://www.wtnh.com/news/connecticut/new-haven/new-haven-clergy-ass-to-meet-and-discuss-policing-in-black-communities/","en","False","","77085","wtnh.com","http://www.wtnh.com/#spider"
"1623140823","2020-06-02 05:57:00","Governors Push Back On Trump's Threat To Deploy Federal Troops To Quell Unrest","https://www.wshu.org/post/governors-push-back-trumps-threat-deploy-federal-troops-quell-unrest","en","False","","189417","wshu.org","http://wshu.org/"
"1623140819","2020-06-02 06:08:00","What We're Reading About The Past Week Of Protests","https://www.wshu.org/post/what-were-reading-about-past-week-protests","en","False","","189417","wshu.org","http://wshu.org/"
"1623140818","2020-06-02 06:15:00","Tuesday's Primaries: Races To Watch And Live Results","https://www.wshu.org/post/tuesdays-primaries-races-watch-and-live-results","en","False","","189417","wshu.org","http://wshu.org/"
"1623140816","2020-06-02 06:23:00","One Week After George Floyd's Death, Protests Continue Across The Country","https://www.wshu.org/post/one-week-after-george-floyds-death-protests-continue-across-country","en","False","","189417","wshu.org","http://wshu.org/"
"1623144381","2020-06-02 06:50:17","Hong Kong leader criticizes 'double standards' over protests","https://www.nhregister.com/news/article/Hong-Kong-leader-criticizes-double-standards-15310001.php","en","True","","32270","nhregister.com","http://nhregister.com#spider"
"1623155408","2020-06-02 06:00:00","Troopers: Man arrested after found walking on highway hours after protest","https://www.nhregister.com/news/article/Troopers-Man-arrested-after-found-walking-on-15310222.php","en","False","","32270","nhregister.com","http://nhregister.com#spider"
"1623205088","2020-06-02 07:53:08","Hong Kong leader criticizes 'double standards' over protests","https://www.theday.com/nationworld-news/20200602/hong-kong-leader-criticizes-double-standards-over-protests","en","False","","76581","theday.com","http://www.theday.com/#spider"
"1623205076","2020-06-02 07:56:11","Demonstrators abroad identify with the cause of US protests","https://www.theday.com/nationworld-news/20200602/demonstrators-abroad-identify-with-cause-of-us-protests","en","False","","76581","theday.com","http://www.theday.com/#spider"
"1623259355","2020-06-02 08:48:17","New Haven Police: Molotov Cocktails Thrown At Substations But Most Protestors Peaceful","https://www.wshu.org/post/new-haven-police-molotov-cocktails-thrown-substations-most-protestors-peaceful","en","False","","189417","wshu.org","http://wshu.org/"
"1623288493","2020-06-02 08:40:05","The Latest: Floyd family expected at memorial service","https://www.norwichbulletin.com/ZZ/news/20200602/latest-floyd-family-expected-at-memorial-service?rssfeed=true","en","False","","74242","norwichbulletin.com","http://www.norwichbulletin.com/#spider"
"1623290678","2020-06-02 09:41:53","‘This was a mob, this was not protesters’: Several officers injured; 65 arrested in violent scene in Providence","https://www.wtnh.com/news/this-was-a-mob-this-was-not-protesters-several-officers-injured-65-arrested-in-violent-scene-in-providence/","en","False","","77085","wtnh.com","http://www.wtnh.com/#spider"
"1623290942","2020-06-02 09:18:36","US cities erupt in more violence amid threats from Trump","https://www.theday.com/nationworld-news/20200602/us-cities-erupt-in-more-violence-amid-threats-from-trump","en","False","","76581","theday.com","http://www.theday.com/#spider"
"1623304307","2020-06-02 09:58:52","Amid domestic US unrest, Pompeo hits China over Tiananmen","https://www.nhregister.com/news/article/Amid-domestic-US-unrest-Pompeo-hits-China-over-15310566.php","en","True","","32270","nhregister.com","http://nhregister.com#spider"
"1623349015","2020-06-02 10:05:15","Watch Live: Biden To Condemn Trump's Protest Response In Speech","https://www.wshu.org/post/watch-live-biden-condemn-trumps-protest-response-speech","en","False","","189417","wshu.org","http://wshu.org/"
"1623352416","2020-06-02 10:52:15","Alders Condemn Police Brutality","https://www.newhavenindependent.org/index.php/archives/entry/alders_police_brutality_resolution/","en","False","","139683","newhavenindependent.org","http://newhavenindependent.org/"
"1623360881","2020-06-02 10:59:06","Kenyans protest as police accused of killing homeless man","https://www.nhregister.com/news/article/Kenyans-protest-as-police-accused-of-killing-15310495.php","en","True","","32270","nhregister.com","http://nhregister.com#spider"
"1623373408","2020-06-02 10:08:30","Barr: Law enforcement must ‘dominate’ streets amid protests","https://www.ctpost.com/news/article/Barr-Law-enforcement-must-dominate-streets-15309926.php","en","True","","35035","ctpost.com","http://www.ctpost.com#spider"
"1623373399","2020-06-02 11:04:22","US cities erupt in more violence amid threats from Trump","https://www.ctpost.com/news/article/Showdown-Law-and-order-president-versus-15310045.php","en","True","","35035","ctpost.com","http://www.ctpost.com#spider"
"1623373396","2020-06-02 11:13:48","Biden: Trump 'consumed' by ego, not leading during crisis","https://www.ctpost.com/news/article/Hate-just-hides-Biden-vows-to-take-on-15309908.php","en","True","","35035","ctpost.com","http://www.ctpost.com#spider"
"1623375970","2020-06-02 10:50:57","Census temporarily closes some field offices due to unrest","https://www.theday.com/nationworld-news/20200602/census-temporarily-closes-some-field-offices-due-to-unrest","en","False","","76581","theday.com","http://www.theday.com/#spider"
"1623376253","2020-06-02 11:16:24","2 officers struck, 1 run over by vehicle; 2 vehicle occupants shot in Buffalo Monday night","https://www.wtnh.com/news/2-officers-struck-1-run-over-by-vehicle-2-vehicle-occupants-shot-in-buffalo-monday-night/","en","False","","77085","wtnh.com","http://www.wtnh.com/#spider"
"1623389340","2020-06-02 11:32:51","Signs from the Floyd protests in Connecticut","https://www.nhregister.com/news/slideshow/Signs-from-the-Floyd-protests-in-Connecticut-202963.php","en","False","","32270","nhregister.com","http://nhregister.com#spider"
"1623396807","2020-06-02 11:15:19","Pelosi to Trump: Be a 'healer in chief'","https://www.nhregister.com/news/article/Pelosi-to-Trump-Be-a-healer-in-chief-15310784.php","en","True","","32270","nhregister.com","http://nhregister.com#spider"
"1623396802","2020-06-02 11:33:38","Confederate monuments targeted by protests come down","https://www.nhregister.com/news/article/Confederate-monument-in-Alabama-partially-removed-15310409.php","en","True","","32270","nhregister.com","http://nhregister.com#spider"
"1623408855","2020-06-02 10:08:30","Barr: Law enforcement must ‘dominate’ streets amid protests","https://www.newstimes.com/news/article/Barr-Law-enforcement-must-dominate-streets-15309926.php","en","True","","24088","newstimes.com","http://www.newstimes.com"
"1623408837","2020-06-02 11:33:38","US cities erupt in more violence amid threats from Trump","https://www.newstimes.com/news/article/Showdown-Law-and-order-president-versus-15310045.php","en","True","","24088","newstimes.com","http://www.newstimes.com"
"1623408831","2020-06-02 11:38:18","Biden: Trump 'consumed' by ego, not leading during crisis","https://www.newstimes.com/news/article/Hate-just-hides-Biden-vows-to-take-on-15309908.php","en","True","","24088","newstimes.com","http://www.newstimes.com"
"1623408828","2020-06-02 11:45:00","Route updated for Danbury protest","https://www.newstimes.com/local/article/Route-updated-for-Danbury-protest-15310883.php","en","False","","24088","newstimes.com","http://www.newstimes.com"
"1623429282","2020-06-02 10:29:00","'He Did Not Pray': Fallout Grows From Trump's Photo-Op At St. John's Church","https://www.wshu.org/post/he-did-not-pray-fallout-grows-trumps-photo-op-st-johns-church","en","False","","189417","wshu.org","http://wshu.org/"
"1623432559","2020-06-02 10:08:30","Barr: Law enforcement must ‘dominate’ streets amid protests","https://www.registercitizen.com/news/article/Barr-Law-enforcement-must-dominate-streets-15309926.php","en","True","","71717","registercitizen.com","http://www.registercitizen.com/#spider"
"1623432567","2020-06-02 10:08:30","Barr: Law enforcement must ‘dominate’ streets amid protests","https://www.greenwichtime.com/news/article/Barr-Law-enforcement-must-dominate-streets-15309926.php","en","True","","69574","greenwichtime.com","http://www.greenwichtime.com/#spider"
"1623432553","2020-06-02 11:32:51","Signs from the Floyd protests in Connecticut","https://www.greenwichtime.com/news/slideshow/Signs-from-the-Floyd-protests-in-Connecticut-202963.php","en","False","","69574","greenwichtime.com","http://www.greenwichtime.com/#spider"
"1623432547","2020-06-02 11:33:38","US cities erupt in more violence amid threats from Trump","https://www.registercitizen.com/news/article/Showdown-Law-and-order-president-versus-15310045.php","en","True","","71717","registercitizen.com","http://www.registercitizen.com/#spider"
"1623432543","2020-06-02 11:58:08","Biden: Trump 'consumed' by ego, not leading during crisis","https://www.registercitizen.com/news/article/Hate-just-hides-Biden-vows-to-take-on-15309908.php","en","True","","71717","registercitizen.com","http://www.registercitizen.com/#spider"
"1623432548","2020-06-02 11:33:38","US cities erupt in more violence amid threats from Trump","https://www.greenwichtime.com/news/article/Showdown-Law-and-order-president-versus-15310045.php","en","True","","69574","greenwichtime.com","http://www.greenwichtime.com/#spider"
"1623432857","2020-06-02 10:08:30","Barr: Law enforcement must ‘dominate’ streets amid protests","https://www.thehour.com/news/article/Barr-Law-enforcement-must-dominate-streets-15309926.php","en","True","","160152","thehour.com","http://thehour.com/"
"1623432546","2020-06-02 11:58:08","Biden: Trump 'consumed' by ego, not leading during crisis","https://www.greenwichtime.com/news/article/Hate-just-hides-Biden-vows-to-take-on-15309908.php","en","True","","69574","greenwichtime.com","http://www.greenwichtime.com/#spider"
"1623433340","2020-06-02 10:08:30","Barr: Law enforcement must ‘dominate’ streets amid protests","https://www.middletownpress.com/news/article/Barr-Law-enforcement-must-dominate-streets-15309926.php","en","True","","122084","middletownpress.com","http://middletownpress.com/"
"1623432849","2020-06-02 11:32:51","Signs from the Floyd protests in Connecticut","https://www.thehour.com/news/slideshow/Signs-from-the-Floyd-protests-in-Connecticut-202963.php","en","False","","160152","thehour.com","http://thehour.com/"
"1623433333","2020-06-02 11:33:38","US cities erupt in more violence amid threats from Trump","https://www.middletownpress.com/news/article/Showdown-Law-and-order-president-versus-15310045.php","en","True","","122084","middletownpress.com","http://middletownpress.com/"
"1623432845","2020-06-02 11:33:38","US cities erupt in more violence amid threats from Trump","https://www.thehour.com/news/article/Showdown-Law-and-order-president-versus-15310045.php","en","True","","160152","thehour.com","http://thehour.com/"
"1623432840","2020-06-02 11:58:08","Biden: Trump 'consumed' by ego, not leading during crisis","https://www.thehour.com/news/article/Hate-just-hides-Biden-vows-to-take-on-15309908.php","en","True","","160152","thehour.com","http://thehour.com/"
"1623433329","2020-06-02 11:58:08","Biden: Trump 'consumed' by ego, not leading during crisis","https://www.middletownpress.com/news/article/Hate-just-hides-Biden-vows-to-take-on-15309908.php","en","True","","122084","middletownpress.com","http://middletownpress.com/"
"1623434119","2020-06-02 10:08:30","Barr: Law enforcement must ‘dominate’ streets amid protests","https://www.greenwichtime.com/news/article/Barr-Law-enforcement-must-dominate-streets-15309926.php","en","True","","157413","greenwichcitizen.com","http://greenwichcitizen.com/"
"1623432307","2020-06-02 10:08:30","Barr: Law enforcement must ‘dominate’ streets amid protests","https://www.thehour.com/news/article/Barr-Law-enforcement-must-dominate-streets-15309926.php","en","True","","361001","Wilton","http://www.thehour.com/wilton_villager/"
"1623434111","2020-06-02 11:32:51","Signs from the Floyd protests in Connecticut","https://www.greenwichtime.com/news/slideshow/Signs-from-the-Floyd-protests-in-Connecticut-202963.php","en","False","","157413","greenwichcitizen.com","http://greenwichcitizen.com/"
"1623434108","2020-06-02 11:33:38","US cities erupt in more violence amid threats from Trump","https://www.greenwichtime.com/news/article/Showdown-Law-and-order-president-versus-15310045.php","en","True","","157413","greenwichcitizen.com","http://greenwichcitizen.com/"
"1623434106","2020-06-02 11:58:08","Biden: Trump 'consumed' by ego, not leading during crisis","https://www.greenwichtime.com/news/article/Hate-just-hides-Biden-vows-to-take-on-15309908.php","en","True","","157413","greenwichcitizen.com","http://greenwichcitizen.com/"
"1623432300","2020-06-02 11:32:51","Signs from the Floyd protests in Connecticut","https://www.thehour.com/news/slideshow/Signs-from-the-Floyd-protests-in-Connecticut-202963.php","en","False","","361001","Wilton","http://www.thehour.com/wilton_villager/"
"1623432299","2020-06-02 11:33:38","US cities erupt in more violence amid threats from Trump","https://www.thehour.com/news/article/Showdown-Law-and-order-president-versus-15310045.php","en","True","","361001","Wilton","http://www.thehour.com/wilton_villager/"
