stories_id,publish_date,title,url,language,ap_syndicated,themes,media_id,media_name,media_url
"1622800880","2020-06-01 20:50:15","Trump declares he's president of law, order amid protests","https://www.oakridger.com/zz/news/20200601/trump-declares-hes-president-of-law-order-amid-protests/1?rssfeed=true","en","False","politics and government, united states politics and government, religion and churches, blacks, armament, defense and military forces, international relations, demonstrations and riots","152402","oakridger.com","http://oakridger.com/"
"1622803523","2020-06-01 20:52:53","TSD FLASH! — Strickland orders curfew","https://tri-statedefender.com/tsd-flash-strickland-orders-curfew/06/01/?utm_source=rss&utm_medium=rss&utm_campaign=tsd-flash-strickland-orders-curfew","en","False","police","284383","Welcome to The Tri-State Defender","http://tsdmemphis.com/"
"1622812633","2020-06-01 20:36:19","DEVELOPING: Protesters march through Johnson City","https://www.wjhl.com/news/local/hundreds-show-up-to-peacefully-protest-for-justice-johnson-city-leaders-speak-out-on-what-they-hope-happens-next/","en","False","roads and traffic, demonstrations and riots","194337","wjhl.com","http://wjhl.com/"
"1622823223","2020-06-01 22:16:07","Court records reveal details of arrests after Nashville protest Saturday night","http://rssfeeds.tennessean.com/~/625819678/0/nashville/home~Court-records-reveal-details-of-arrests-after-Nashville-protest-Saturday-night/","en","False","blacks, police, demonstrations and riots, fires and firefighters, police brutality and misconduct","73100","blogs.tennessean.com","http://blogs.tennessean.com/#spider"
"1622835563","2020-06-01 23:00:58","President Donald Trump addressed the Nation","https://www.clarksvilleonline.com/2020/06/01/president-donald-trump-addressed-the-nation/?utm_source=rss&utm_medium=rss&utm_campaign=president-donald-trump-addressed-the-nation","en","False","politics and government, united states politics and government, medicine and health, crime and criminals, demonstrations and riots","24816","clarksvilleonline.com","http://www.clarksvilleonline.com"
"1622835661","2020-06-01 23:43:42","Peaceful demonstrators march through downtown Knoxville","https://www.wate.com/news/peaceful-demonstrators-march-through-downtown-knoxville/","en","False","blacks, crime and criminals, demonstrations and riots","84580","wate.com","http://www.wate.com/#spider"
"1622840160","2020-06-01 09:30:31","Police Arrest Man Accused of Starting Fire at Metro Courthouse","http://www.nashvillescene.com/news/pith-in-the-wind/article/21135725/police-arrest-man-accused-of-starting-fire-at-metro-courthouse","en","False","police, demonstrations and riots, murders and attempted murders, arson, assaults, attacks on police","73643","nashvillescene.com","http://www.nashvillescene.com/#spider"
"1622840146","2020-06-01 11:58:19","Nashville Under Third Night of Curfew","http://www.nashvillescene.com/news/pith-in-the-wind/article/21135768/nashville-under-a-third-night-of-curfew","en","False","politics and government, demonstrations and riots","73643","nashvillescene.com","http://www.nashvillescene.com/#spider"
"1622840130","2020-06-01 13:03:57","What's the Deal With Stacy Case?","http://www.nashvillescene.com/news/pith-in-the-wind/article/21135765/whats-the-deal-with-stacy-case","en","False","police, demonstrations and riots","73643","nashvillescene.com","http://www.nashvillescene.com/#spider"
"1622840114","2020-06-01 13:48:13","Scenes From Sunday's Murfreesboro Rally Against Police Brutality","http://www.nashvillescene.com/media-gallery/photo-galleries/media-gallery/21135793/murfreesboro-rally-53120","en","False","politics and government, police, demonstrations and riots","73643","nashvillescene.com","http://www.nashvillescene.com/#spider"
"1622840106","2020-06-01 18:00:33","Blackout Tuesday: #TheShowMustBePaused","http://www.nashvillescene.com/music/nashville-cream/article/21135836/blackout-tuesday-theshowmustbepaused","en","False","police, music, demonstrations and riots, electric light and power","73643","nashvillescene.com","http://www.nashvillescene.com/#spider"
"1622851188","2020-06-01 23:50:08","National Guard lays down shields in peaceful protest held at Tennessee state capitol","https://www.wkrn.com/news/national-guard-lays-down-shields-in-peaceful-protest-held-at-tennessee-state-capitol/","en","False","politics and government, religion and churches, demonstrations and riots","84748","wkrn.com","http://www.wkrn.com/#spider"
"1622866307","2020-06-01 19:38:05","Mayor Jim Strickland announces 10 p.m. - 6 a.m. curfew in City of Memphis - localmemphis.com","https://www.localmemphis.com/article/news/local/memphis-protest-fourth-night-george-floyd-death/522-646a8caa-848b-466f-9be2-49eadf319e7b","en","False","police, demonstrations and riots, violence","658835","State News - United States - Tennessee","http://www.tennessee.statenews.net/"
"1622866301","2020-06-01 19:38:55","Protesters Took to Memphis Streets Over Weekend, Speaking Out Against Police Brutality  Blog","https://www.memphisflyer.com/NewsBlog/archives/2020/06/01/protesters-took-to-memphis-streets-over-weekend-speaking-out-against-police-brutality","en","False","police, demonstrations and riots","658835","State News - United States - Tennessee","http://www.tennessee.statenews.net/"
"1622916194","2020-06-01 23:54:01","Victims of police brutality hold protest","https://www.wbbjtv.com/2020/06/01/victims-of-police-brutality-hold-protest/","en","False","police, crime and criminals, police brutality and misconduct, attacks on police","25678","wbbjtv.com","http://www.wbbjtv.com"
"1622975128","2020-06-02 03:46:04","Trump vows to mobilize military to quell US protests","https://www.laprensalatina.com/trump-vows-to-mobilize-military-to-quell-us-protests/","en","False","politics and government, united states politics and government, armament, defense and military forces, crime and criminals, united states international relations, international relations, demonstrations and riots","287422","laprensalatina.com","http://laprensalatina.com/"
"1623009924","2020-06-02 04:46:04","Concern in Philippines over Duerte’s new anti-terrorism law","https://www.laprensalatina.com/concern-in-philippines-over-duertes-new-anti-terrorism-law/","en","False","politics and government, law and legislation, medicine and health, international relations, diseases and conditions, viruses, freedom and human rights","287422","laprensalatina.com","http://laprensalatina.com/"
"1623026700","2020-06-02 04:42:00","Faith and city leaders to hold prayer vigil Tuesday","https://www.wsmv.com/news/faith-and-city-leaders-to-hold-prayer-vigil-tuesday/article_f1e5520c-a4ac-11ea-8dda-13ed2b1719cc.html","en","False","politics and government, demonstrations and riots","71152","wsmv.com","http://www.wsmv.com/#spider"
"1623091438","2020-06-02 05:00:00","Sports Figures Add Their Voices To Those Of Angry Protesters","https://www.wmot.org/post/sports-figures-add-their-voices-those-angry-protesters","en","False","blacks, discrimination, demonstrations and riots","310386","wmot.org","http://wmot.org/"
"1623099011","2020-06-02 05:57:00","Governors Push Back On Trump's Threat To Deploy Federal Troops To Quell Unrest","https://www.wmot.org/post/governors-push-back-trumps-threat-deploy-federal-troops-quell-unrest","en","False","politics and government, united states politics and government, demonstrations and riots","310386","wmot.org","http://wmot.org/"
"1623099010","2020-06-02 06:08:00","What We're Reading About The Past Week Of Protests","https://www.wmot.org/post/what-were-reading-about-past-week-protests","en","False","blacks, police, news and news media, demonstrations and riots, murders and attempted murders, police brutality and misconduct","310386","wmot.org","http://wmot.org/"
"1623099007","2020-06-02 06:15:00","Tuesday's Primaries: Races To Watch And Live Results","https://www.wmot.org/post/tuesdays-primaries-races-watch-and-live-results","en","False","politics and government, united states politics and government, elections, presidents and presidency (us), presidential elections (us), primaries","310386","wmot.org","http://wmot.org/"
"1623099005","2020-06-02 06:23:00","One Week After George Floyd's Death, Protests Continue Across The Country","https://www.wmot.org/post/one-week-after-george-floyds-death-protests-continue-across-country","en","False","politics and government, armament, defense and military forces, police, demonstrations and riots, police brutality and misconduct","310386","wmot.org","http://wmot.org/"
"1623122460","2020-06-02 05:24:20","Patti Payne: Calls for unity and action rise amid civil unrest","http://feeds.bizjournals.com/~r/industry_17/~3/ZUH6QH8V-NI/patti-payne-calls-for-unity-and-action-rise.html","en","False","blacks, police, demonstrations and riots, police brutality and misconduct","663140","Memphis Business Journal","http://www.bizjournals.com/memphis/"
"1623122651","2020-06-02 05:24:20","Patti Payne: Calls for unity and action rise amid civil unrest","http://feeds.bizjournals.com/~r/industry_17/~3/ZUH6QH8V-NI/patti-payne-calls-for-unity-and-action-rise.html","en","False","","663152","Nashville Business Journal","http://www.bizjournals.com/nashville/"
"1623144888","2020-06-01 21:28:00","'Nowhere to be found': Governors blast Trump after he tells them they are 'weak' on phone call","http://rssfeeds.tennessean.com/~/625800710/0/nashville/home~Nowhere-to-be-found-Governors-blast-Trump-after-he-tells-them-they-are-weak-on-phone-call/","en","False","","73100","blogs.tennessean.com","http://blogs.tennessean.com/#spider"
"1623145557","2020-06-02 00:00:00","ETSU president, student government call for action, unity amid nationwide unrest","http://www.johnsoncitypress.com/Education/2020/06/02/ETSU-president-student-government.html","en","False","","94065","johnsoncitypress.com","http://www.johnsoncitypress.com/#spider"
"1623145615","2020-06-02 06:28:50","Protests last into the night in Johnson City","https://www.wate.com/news/protests-last-into-the-night-in-johnson-city/","en","False","","84580","wate.com","http://www.wate.com/#spider"
"1623145614","2020-06-02 06:11:47","National Guard lays down shields in peaceful protest held at Tennessee capitol","https://www.wate.com/news/top-stories/national-guard-lays-down-shields-in-peaceful-protest-held-at-tennessee-capitol/","en","False","","84580","wate.com","http://www.wate.com/#spider"
"1623204635","2020-06-02 05:17:46","Police: 4 St. Louis officers hit by gunfire during protests","https://www.wkrn.com/news/police-4-st-louis-officers-hit-by-gunfire-during-protests/","en","True","","84748","wkrn.com","http://www.wkrn.com/#spider"
"1623204632","2020-06-02 05:40:04","Trump threatens military force against protesters nationwide","https://www.wkrn.com/news/trump-threatens-military-force-against-protesters-nationwide/","en","True","","84748","wkrn.com","http://www.wkrn.com/#spider"
"1623204630","2020-06-02 05:52:02","Music industry calls for Black Out Tuesday amid unrest","https://www.wkrn.com/news/music-industry-calls-for-black-out-tuesday-amid-unrest/","en","True","","84748","wkrn.com","http://www.wkrn.com/#spider"
"1623204628","2020-06-02 07:59:30","Protests, Louisville police chief fired after fatal shooting","https://www.wkrn.com/news/kentucky/protests-louisville-police-chief-fired-after-fatal-shooting/","en","True","","84748","wkrn.com","http://www.wkrn.com/#spider"
"1623205420","2020-06-02 07:13:25","Freedom rider appalled by Nashville unrest, destruction of civil rights plaque","https://www.newschannel5.com/news/freedom-rider-appalled-by-nashville-unrest-destruction-of-civil-rights-plaque","en","False","","658835","State News - United States - Tennessee","http://www.tennessee.statenews.net/"
"1623205438","2020-06-02 07:13:22","Former Knoxville man charged in arson at historic Nashville courthouse","https://www.knoxnews.com/story/news/crime/2020/06/01/wesley-somers-arrest-nashville-protests-courthouse-fire-arson/5310092002/","en","False","","658835","State News - United States - Tennessee","http://www.tennessee.statenews.net/"
"1623205469","2020-06-02 01:48:15","Court records reveal details of arrests after Nashville protest Saturday","https://www.tennessean.com/story/news/2020/06/01/nashville-protest-arrests-details-court-records/5312579002/","en","False","","658835","State News - United States - Tennessee","http://www.tennessee.statenews.net/"
"1623205415","2020-06-02 07:13:25","Did the Nashville protest spread coronavirus&quest; We will know in a week.","https://www.tennessean.com/story/news/health/2020/06/01/did-nashville-protest-spread-coronavirus-we-know-week/5307905002/","en","False","","658835","State News - United States - Tennessee","http://www.tennessee.statenews.net/"
"1623204624","2020-06-02 06:18:00","Murfreesboro mayor defends use of tear gas","https://www.wkrn.com/news/local-news/murfreesboro-mayor-defends-use-of-tear-gas/","en","False","","84748","wkrn.com","http://www.wkrn.com/#spider"
"1623204623","2020-06-02 05:29:00","Prayer vigil planned for Tuesday evening at Nashville’s Historic Courthouse","https://www.wkrn.com/news/local-news/prayer-vigil-planned-for-tuesday-evening-at-nashvilles-historic-courthouse/","en","False","","84748","wkrn.com","http://www.wkrn.com/#spider"
"1623207152","2020-06-02 08:18:23","Tear gas, threats for protesters before Trump visits church","http://www.nashvilleledger.com/editorial/Article.aspx?id=129805","en","True","","285648","tnledger.com","http://tnledger.com/"
"1623207148","2020-06-02 08:17:24","Amid protests, Trump talks of war — and reelection","http://www.nashvilleledger.com/editorial/Article.aspx?id=129803","en","True","","285648","tnledger.com","http://tnledger.com/"
"1623207143","2020-06-02 08:16:54","Showdown: Law-and-order president versus protesters","http://www.nashvilleledger.com/editorial/Article.aspx?id=129802","en","True","","285648","tnledger.com","http://tnledger.com/"
"1623207141","2020-06-02 08:16:33","Barr: Law enforcement must 'dominate' streets amid protests","http://www.nashvilleledger.com/editorial/Article.aspx?id=129801","en","True","","285648","tnledger.com","http://tnledger.com/"
"1623207105","2020-06-02 08:14:03","Tennessee Floyd protests result in arrests, curfews","http://www.nashvilleledger.com/editorial/Article.aspx?id=129794","en","True","","285648","tnledger.com","http://tnledger.com/"
"1623243636","2020-06-02 00:00:00","Sethi applauds president's condemnation of riots","http://www.johnsoncitypress.com/Politics/2020/06/02/Sethi.html","en","False","","94065","johnsoncitypress.com","http://www.johnsoncitypress.com/#spider"
"1623317204","2020-06-02 10:19:08","The crusade: When Billy Graham brought Richard Nixon to Knoxville | Opinion","http://rssfeeds.knoxnews.com/~/625861650/0/knoxville/opinion/~The-crusade-When-Billy-Graham-brought-Richard-Nixon-to-Knoxville-Opinion/","en","False","","607964","Shopper News","https://www.knoxnews.com/shopper-news/"
"1623318683","2020-06-02 10:19:08","The crusade: When Billy Graham brought Richard Nixon to Knoxville | Opinion","http://rssfeeds.knoxnews.com/~/625861650/0/knoxville/opinion/~The-crusade-When-Billy-Graham-brought-Richard-Nixon-to-Knoxville-Opinion/","en","False","","89","The Knoxville News Sentinel ","http://www.knoxnews.com/"
"1623318896","2020-06-02 10:19:08","The crusade: When Billy Graham brought Richard Nixon to Knoxville | Opinion","http://rssfeeds.commercialappeal.com/~/625861650/0/memphis/opinion~The-crusade-When-Billy-Graham-brought-Richard-Nixon-to-Knoxville-Opinion/","en","False","","71","The Commercial Appeal","http://www.commercialappeal.com/"
"1623319958","2020-06-02 00:00:00","Wise County protest over George Floyd death draws wide range of people","http://www.timesnews.net/Politics/2020/06/02/Wise-County-protest-over-George-Floyd-death-draws-wide-range-of-people.html","en","False","","653457","Kingsport Times-News","http://www.timesnews.net/"
"1623349411","2020-06-02 10:19:08","The crusade: When Billy Graham brought Richard Nixon to Knoxville | Opinion","http://rssfeeds.tennessean.com/~/625861650/0/nashville/home~The-crusade-When-Billy-Graham-brought-Richard-Nixon-to-Knoxville-Opinion/","en","False","","73100","blogs.tennessean.com","http://blogs.tennessean.com/#spider"
"1623349406","2020-06-02 09:09:49","'I am outraged': DC bishop denounces Trump's church visit after police clear protesters with tear gas","http://rssfeeds.tennessean.com/~/625820098/0/nashville/home~I-am-outraged-DC-bishop-denounces-Trumps-church-visit-after-police-clear-protesters-with-tear-gas/","en","False","","73100","blogs.tennessean.com","http://blogs.tennessean.com/#spider"
"1623351814","2020-06-02 04:00:00","Take a moment to listen","https://www.farmprogress.com/commentary/take-moment-listen","en","False","","221000","deltafarmpress.com","http://deltafarmpress.com/"
"1623357813","2020-06-02 11:04:29","‘This was a mob, this was not protesters’: 9 officers injured; 65 arrested at violent scene in Providence","https://www.wkrn.com/news/this-was-a-mob-this-was-not-protesters-9-officers-injured-65-arrested-at-violent-scene-in-providence/","en","False","","84748","wkrn.com","http://www.wkrn.com/#spider"
"1623370470","2020-06-02 10:29:00","'He Did Not Pray': Fallout Grows From Trump's Photo-Op At St. John's Church","https://www.wmot.org/post/he-did-not-pray-fallout-grows-trumps-photo-op-st-johns-church","en","False","","310386","wmot.org","http://wmot.org/"
"1623378677","2020-06-02 07:33:08","Police, Protesters Take Knee Together At Miller Park","http://www.chattanoogan.com/2020/6/2/409913/Police-Protesters-Take-Knee-Together.aspx","en","False","","663090","Chattanoogan","http://www.chattanoogan.com/Breaking-News/"
"1623384141","2020-06-02 06:00:18","As a nation and a city protest racial injustice, the greatest Memphis sports story isn't good enough anymore","http://rssfeeds.commercialappeal.com/~/625853812/0/memphis/grizzlies~As-a-nation-and-a-city-protest-racial-injustice-the-greatest-Memphis-sports-story-isnt-good-enough-anymore/","en","False","","71","The Commercial Appeal","http://www.commercialappeal.com/"
"1623385301","2020-06-02 11:34:45","Confederate monument in Alabama partially removed","https://www.wkrn.com/news/alabama/confederate-monument-in-alabama-partially-removed/","en","True","","84748","wkrn.com","http://www.wkrn.com/#spider"
"1623429621","2020-06-02 11:36:11","Confederate monuments toppled, burned as protests over George Floyd's death continue","http://rssfeeds.tennessean.com/~/625799696/0/nashville/home~Confederate-monuments-toppled-burned-as-protests-over-George-Floyds-death-continue/","en","False","","73100","blogs.tennessean.com","http://blogs.tennessean.com/#spider"
"1623429618","2020-06-02 12:13:17","George Floyd protests, vigils set for Spring Hill, Franklin, Clarksville Tuesday","http://rssfeeds.tennessean.com/~/625879280/0/nashville/home~George-Floyd-protests-vigils-set-for-Spring-Hill-Franklin-Clarksville-Tuesday/","en","False","","73100","blogs.tennessean.com","http://blogs.tennessean.com/#spider"
"1623434211","2020-06-01 20:32:32","Trump declares he’s president of law and order, threatens to deploy U.S. military","https://wreg.com/news/trump-declares-hes-president-of-law-and-order-threatens-to-deploy-u-s-military/","en","True","","78089","wreg.com","http://www.wreg.com/#spider"
"1623434204","2020-06-02 09:39:19","Suspects accused of stealing clothes, TV from Walmart amid night of unrest","https://wreg.com/news/suspects-accused-of-stealing-clothes-tv-from-walmart-amid-night-of-unrest/","en","False","","78089","wreg.com","http://www.wreg.com/#spider"
"1623448617","2020-06-02 00:00:00","The Latest: Virginia governor rejects national guard request","http://www.timesnews.net/Nation/2020/06/02/The-Latest-Virginia-governor-rejects-national-guard-request.html","en","False","","653457","Kingsport Times-News","http://www.timesnews.net/"
"1623451280","2020-06-02 11:58:00","'He Thinks Division Helps Him': Biden Condemns Trump's Protest Response","https://www.wmot.org/post/he-thinks-division-helps-him-biden-condemns-trumps-protest-response","en","False","","310386","wmot.org","http://wmot.org/"
"1623451451","2020-06-02 00:00:00","Biden: Trump 'consumed' by ego, not leading during crisis","http://www.johnsoncitypress.com/Politics/2020/06/02/Biden-Trump-consumed-by-ego-not-leading-during-crisis.html","en","False","","94065","johnsoncitypress.com","http://www.johnsoncitypress.com/#spider"
"1623451890","2020-06-02 12:00:10","Pelosi to Trump: Be a 'healer in chief'","http://www.nashvilleledger.com/editorial/Article.aspx?id=129810","en","True","","285648","tnledger.com","http://tnledger.com/"
"1623451888","2020-06-02 12:01:09","Biden: Trump 'consumed' by ego, not leading during crisis","http://www.nashvilleledger.com/editorial/Article.aspx?id=129811","en","True","","285648","tnledger.com","http://tnledger.com/"
"1623453061","2020-06-02 12:13:17","George Floyd protests, vigils set for Spring Hill, Franklin, Clarksville Tuesday","http://rssfeeds.theleafchronicle.com/~/625879280/0/clarksville/home~George-Floyd-protests-vigils-set-for-Spring-Hill-Franklin-Clarksville-Tuesday/","en","False","","143905","theleafchronicle.com","http://theleafchronicle.com/"
"1623457185","2020-06-02 12:27:46","#TheShowMustBePaused: Music industry plans blackout Tuesday in response to George Floyd death","http://rssfeeds.knoxnews.com/~/625774460/0/knoxville/home/~TheShowMustBePaused-Music-industry-plans-blackout-Tuesday-in-response-to-George-Floyd-death/","en","False","","89","The Knoxville News Sentinel ","http://www.knoxnews.com/"
"1623457179","2020-06-02 05:00:30","Past pandemics in Knoxville have led to stark political choices — with deadly consequences","http://rssfeeds.knoxnews.com/~/625848644/0/knoxville/home/~Past-pandemics-in-Knoxville-have-led-to-stark-political-choices-%e2%80%94-with-deadly-consequences/","en","False","","89","The Knoxville News Sentinel ","http://www.knoxnews.com/"
"1623456850","2020-05-31 17:22:14","Exclusive: Nashville police looking for 20-30 people they say drove violence during Saturday protest","http://rssfeeds.knoxnews.com/~/625707858/0/knoxville/home/~Exclusive-Nashville-police-looking-for-people-they-say-drove-violence-during-Saturday-protest/","en","False","","607964","Shopper News","https://www.knoxnews.com/shopper-news/"
"1623456873","2020-06-02 12:27:46","#TheShowMustBePaused: Music industry plans blackout Tuesday in response to George Floyd death","http://rssfeeds.knoxnews.com/~/625774460/0/knoxville/home/~TheShowMustBePaused-Music-industry-plans-blackout-Tuesday-in-response-to-George-Floyd-death/","en","False","","607964","Shopper News","https://www.knoxnews.com/shopper-news/"
"1623456842","2020-06-02 05:00:30","Past pandemics in Knoxville have led to stark political choices — with deadly consequences","http://rssfeeds.knoxnews.com/~/625848644/0/knoxville/home/~Past-pandemics-in-Knoxville-have-led-to-stark-political-choices-%e2%80%94-with-deadly-consequences/","en","False","","607964","Shopper News","https://www.knoxnews.com/shopper-news/"
"1623461400","2020-05-28 18:50:05","Tear gas flies as Minneapolis rioters protest death of George Floyd in police custody","https://tntribune.com/tear-gas-flies-as-minneapolis-rioters-protest-death-of-george-floyd-in-police-custody/","en","False","","104795","The Tennessee Tribune","http://www.thetennesseetribune.com"
"1623461399","2020-05-28 19:01:46","Fires blaze and looters rampage during second night of Minneapolis anti-police protests following black man’s death","https://tntribune.com/fires-blaze-and-looters-rampage-during-second-night-of-minneapolis-anti-police-protests-following-black-mans-death/","en","False","","104795","The Tennessee Tribune","http://www.thetennesseetribune.com"
"1623462547","2020-06-02 13:03:53","Asheville protests: Second day started peacefully, ended with more destruction and gun shots","http://rssfeeds.knoxnews.com/~/625887764/0/knoxville/home/~Asheville-protests-Second-day-started-peacefully-ended-with-more-destruction-and-gun-shots/","en","False","","607964","Shopper News","https://www.knoxnews.com/shopper-news/"
"1623464215","2020-06-02 00:00:00","Police arrest 11 at overnight protest in Johnson City","http://www.johnsoncitypress.com/law-enforcement/2020/06/02/Police-arrest-11-at-overnight-protest-in-Johnson-City.html","en","False","","94065","johnsoncitypress.com","http://www.johnsoncitypress.com/#spider"
"1623481387","2020-06-02 12:13:17","George Floyd protests, vigils set for Spring Hill, Franklin, Clarksville Tuesday","http://rssfeeds.dnj.com/~/625879280/0/murfreesboro/home~George-Floyd-protests-vigils-set-for-Spring-Hill-Franklin-Clarksville-Tuesday/","en","False","","90683","dnj.com","http://www.dnj.com/#spider"
"1623481361","2020-06-02 13:07:53","Rutherford County Jail reports rise of COVID-19 cases involving 21 inmates, 3 employees","http://rssfeeds.dnj.com/~/625884312/0/murfreesboro/home~Rutherford-County-Jail-reports-rise-of-COVID-cases-involving-inmates-employees/","en","False","","90683","dnj.com","http://www.dnj.com/#spider"
"1623502782","2020-06-02 13:34:31","Bishop ‘outraged’ after President Trump poses with Bible in front of St. John’s Church","https://www.wate.com/news/bishop-outraged-after-president-trump-poses-with-bible-in-front-of-st-johns-church/","en","False","","84580","wate.com","http://www.wate.com/#spider"
"1623506636","2020-06-02 11:00:34","US cities erupt in more violence amid threats from Trump","https://www.oakridger.com/zz/news/20200602/us-cities-erupt-in-more-violence-amid-threats-from-trump?rssfeed=true","en","False","","152402","oakridger.com","http://oakridger.com/"
"1623506633","2020-06-02 11:03:19","Stocks open higher as investors hope for economic recovery","https://www.oakridger.com/zz/news/20200602/stocks-open-higher-as-investors-hope-for-economic-recovery?rssfeed=true","en","False","","152402","oakridger.com","http://oakridger.com/"
